{
  "$schema": "http://json-schema.org/draft-07/schema#",
  "$id": "https://oes.inklyre.org/schemas/orf/v0.1.0/resource.schema.json",
  "title": "ORF Resource",
  "description": "Schema for resource.json, a reference document (a PDF, an ebook, a paper, slides) in the Open Resource Format (ORF), version 0.1.0. document_url points at wherever the actual file is hosted and is always required as the canonical source. Distinct from OAF: an ORF resource is a document OES doesn't own or render as prose — a genuine written article always belongs in OAF instead. A resource MAY additionally carry a local_path to a bundled copy of the file, for fully offline/portable packages, when downloadable permits it.",
  "type": "object",
  "required": ["orf_version", "id", "title", "document_url"],
  "additionalProperties": true,
  "properties": {
    "$schema": {
      "type": "string",
      "description": "Optional. Points an editor (e.g. VS Code) at this document's JSON Schema for inline validation/autocomplete. A JSON-tooling convention, not part of the OES content model — an OES parser ignores it like any other unrecognized field."
    },
    "orf_version": {
      "type": "string",
      "pattern": "^0\\.1\\.\\d+$",
      "description": "Any 0.1.x patch release of ORF — see the Versioning & Conformance policy for what's allowed to change in a patch."
    },
    "id": {
      "type": "string",
      "pattern": "^[a-z0-9]+(-[a-z0-9]+)*$",
      "description": "Kebab-case. Must match this resource's folder name when co-located (referenced via a `path`)."
    },
    "title": {
      "type": "string",
      "minLength": 1
    },
    "description": {
      "type": "string"
    },
    "authors": {
      "type": "array",
      "items": { "type": "string" },
      "description": "GitHub usernames of the authors. A resource can be hosted and reused independently of any lesson, so it needs its own attribution."
    },
    "license": {
      "type": "string",
      "description": "SPDX license identifier, e.g. \"CC-BY-4.0\". This describes the resource's own metadata (title, description, table of contents); it does not by itself grant redistribution rights to the underlying document file — see `downloadable`."
    },
    "document_url": {
      "type": "string",
      "format": "uri",
      "description": "Where the actual document is hosted. ORF describes metadata about the document, not the document file itself."
    },
    "page_count": {
      "type": "integer",
      "minimum": 1
    },
    "downloadable": {
      "type": "boolean",
      "default": false,
      "description": "Whether the file at document_url may be downloaded and redistributed as part of an exported/portable OES package. Only set true when you hold the rights to redistribute the document file itself (self-hosted or appropriately licensed content) — never for a third-party-hosted file where mirroring it would violate that source's terms. Consuming apps must treat the absence of this field, or a value of false, as \"do not download and bundle this file\"."
    },
    "local_path": {
      "type": "string",
      "pattern": "^[^/]+\\.(pdf|epub)$",
      "description": "Filename (no subdirectories), from this resource.json's own folder, to a locally-bundled copy of the document file — present only when an app has already downloaded it (permitted by `downloadable: true`) and included it in this package for offline reading. Author-written resource.json files normally omit this entirely; it's populated by tooling, not hand-authored, and is not meant to be committed to the authoring git repo — see the Offline & Portable Packages guidance for the recommended .gitignore pattern this fixed extension set enables. A consumer that finds the file at this path should prefer reading it over fetching document_url, and fall back to document_url when it's absent or missing."
    },
    "status": {
      "type": "string",
      "enum": ["draft", "published", "deprecated"],
      "description": "Content lifecycle stage. Absent is equivalent to \"published\" — this field exists for a consumer that wants to hide draft/deprecated content or an author's own tooling, not to gate access by itself."
    },
    "tags": {
      "type": "array",
      "items": { "type": "string" }
    },
    "language": {
      "type": "string",
      "description": "Primary written language, BCP 47 tag."
    },
    "toc": {
      "type": "array",
      "description": "Table of contents — page-anchored sections, so a consuming app can build real chapter navigation instead of a raw page-by-page scroll. Optional; omit for a short document with no natural sections.",
      "items": {
        "type": "object",
        "required": ["label", "page"],
        "properties": {
          "label": { "type": "string" },
          "page": { "type": "integer", "minimum": 1 }
        }
      }
    },
    "references": {
      "type": "array",
      "items": { "$ref": "#/definitions/reference" },
      "description": "Cited sources — papers, books, or sites this document's content is based on. Each entry is either a bare URL (the simple case) or a richer object — needed for a source with no single URL, like a print book (identified by isbn) or a paper (identified by doi)."
    },
    "related": {
      "type": "array",
      "items": { "$ref": "#/definitions/related_item" },
      "description": "Suggested material for a learner who wants to go further after this specific resource — a related reading, a recommended book, another course. Distinct from references, which documents this resource's own sources rather than suggesting where to go next."
    },
    "source": { "$ref": "#/definitions/source" }
  },
  "patternProperties": {
    "^x_[a-z0-9_]+$": {}
  },
  "definitions": {
    "reference": {
      "description": "A cited source or further-reading pointer.",
      "oneOf": [
        { "type": "string", "format": "uri", "description": "Shorthand for a source that's just a URL, nothing more." },
        {
          "type": "object",
          "required": ["title"],
          "additionalProperties": true,
          "properties": {
            "title": { "type": "string", "minLength": 1 },
            "type": {
              "type": "string",
              "enum": ["article", "book", "paper", "video", "website", "dataset", "other"],
              "default": "website"
            },
            "authors": { "type": "array", "items": { "type": "string" } },
            "url": {
              "type": "string",
              "format": "uri",
              "description": "Where to find this source online. Omit entirely for a source with no online location, e.g. a print-only book — isbn/publisher/year identify it instead."
            },
            "isbn": {
              "type": "string",
              "description": "For type: book. ISBN-10 or ISBN-13, digits and optional hyphens."
            },
            "doi": {
              "type": "string",
              "description": "For type: paper. Digital Object Identifier, e.g. \"10.1000/xyz123\"."
            },
            "publisher": { "type": "string" },
            "year": { "type": "integer" },
            "note": {
              "type": "string",
              "description": "Why this source is included, e.g. \"primary source for the historical claims in section 2\"."
            }
          }
        }
      ]
    },
    "related_item": {
      "description": "A suggested piece of material for the learner to explore further — distinct from `references`, which documents this content's own sources. Either an OES-native pointer (`path` or one of the `*_url` fields, the same idiom used by every other cross-reference in OES, so a consuming app can fetch it and render it richly — real duration, thumbnail, etc.) or a fully external pointer (a bare `url`) for anything not itself modeled as OES content, e.g. a YouTube video or a book's product page.",
      "type": "object",
      "required": ["title", "type"],
      "additionalProperties": true,
      "oneOf": [
        { "required": ["path"] },
        { "required": ["video_lesson_url"] },
        { "required": ["article_url"] },
        { "required": ["set_url"] },
        { "required": ["course_url"] },
        { "required": ["resource_url"] },
        { "required": ["url"] }
      ],
      "properties": {
        "title": { "type": "string", "minLength": 1 },
        "type": {
          "type": "string",
          "enum": ["video", "article", "book", "course", "practice_set", "resource", "file", "link", "other"],
          "description": "What kind of thing this is, independent of how it's addressed below."
        },
        "path": { "type": "string", "description": "Path to co-located OES content (a video.json, article.json, set.json, course.json, or resource.json) this entry points at." },
        "video_lesson_url": { "type": "string", "format": "uri" },
        "article_url": { "type": "string", "format": "uri" },
        "set_url": { "type": "string", "format": "uri" },
        "course_url": { "type": "string", "format": "uri" },
        "resource_url": { "type": "string", "format": "uri" },
        "url": {
          "type": "string",
          "format": "uri",
          "description": "For material not modeled as OES content at all — e.g. a YouTube video, an external article, a book's product page."
        },
        "content_hash": {
          "type": "string",
          "pattern": "^sha256-[A-Fa-f0-9]{64}$",
          "description": "Optional sha256 pin, meaningful only alongside one of the *_url fields."
        },
        "note": {
          "type": "string",
          "description": "Why this is suggested, e.g. \"if you want a deeper dive into the underlying math\"."
        }
      }
    },
    "source": {
      "description": "Where this content was originally sourced or adapted from, if it wasn't authored directly for OES — e.g. produced by an importer against another platform's content. Entirely optional; omit for content authored directly. Distinct from this document's own top-level `license`, which describes this OES document's license, not what it was adapted from — the original may be more restrictive (or simply different) and belongs in `source.license` instead. Also distinct from `downloadable`/`local_path`: `source` records provenance, it never by itself grants redistribution rights to the underlying document file.",
      "type": "object",
      "required": ["url"],
      "additionalProperties": true,
      "properties": {
        "url": {
          "type": "string",
          "format": "uri",
          "description": "The original content's own URL."
        },
        "platform": {
          "type": "string",
          "description": "Free-text label for the originating platform or site. Deliberately not an enum — OES doesn't hard-code or endorse any specific platform; any importer fills in whatever's accurate."
        },
        "license": {
          "type": "string",
          "description": "The ORIGINAL content's license or terms of use at the source. Free text, not constrained to SPDX like this document's own `license` field."
        },
        "retrieved_at": {
          "type": "string",
          "format": "date",
          "description": "When this content was fetched/adapted from the source."
        },
        "note": {
          "type": "string",
          "description": "Free-text context an importer or author wants to record."
        }
      }
    }
  }
}
