{
  "orf_version": "0.1.0",
  "id": "sicp-chapter-1",
  "title": "Structure and Interpretation of Computer Programs — Chapter 1",
  "document_url": "https://example.com/books/sicp/chapter-1.pdf",
  "page_count": 42,
  "license": "CC-BY-SA-4.0",
  "toc": [
    { "label": "1.1 The Elements of Programming", "page": 1 },
    { "label": "1.2 Procedures and the Processes They Generate", "page": 15 },
    { "label": "1.3 Formulating Abstractions with Higher-Order Procedures", "page": 30 }
  ],
  "references": [
    "https://mitpress.mit.edu/sicp/"
  ],
  "related": [
    { "type": "video", "title": "SICP Lecture 1a", "url": "https://www.youtube.com/watch?v=2Op3QLzMgSY" }
  ]
}
